{
  "brief_hash": "9fa3f192",
  "final_iteration": "002",
  "content": "처음 글쓰기 하네스 README를 읽고 실행 흐름을 따라가며 가장 먼저 든 생각은, 이 도구가 글을 대신 써주는 장치라기보다 글이 만들어지는 과정을 붙잡아 두는 장치에 가깝다는 것이었다. README가 말하는 핵심은 자동 작문이 아니라 반복 가능한 초안 생성 시스템이다. Gen, Critique, Eval, Refine, Validator가 각자 맡은 일만 하고, 단계 사이의 전달은 파일과 JSON payload로 제한된다. 이 구조를 써보며 느낀 장점도 바로 거기에 있었다. 글이 좋아졌는지 아닌지를 감으로만 보는 대신, 어느 단계에서 어떤 신호가 생겼고 다음 초안에 무엇이 반영됐는지 확인할 수 있었다.\n\n가장 큰 장점은 역할 분리에서 온다. Gen은 초안을 만들고, Critique는 독자가 약하게 느낄 지점을 짚고, Eval은 별도의 기준으로 평가하며, Refine은 허용된 입력만 보고 다시 쓴다. Validator는 창작자가 아니라 스키마, 길이, 금칙어, brief_hash 같은 기계적 계약을 확인하는 게이트다. 이 경계가 처음에는 다소 딱딱하게 보였지만, 실제로는 판단을 쉽게 만들어 주는 순간이 있었다. 초안이 마음에 들지 않을 때 “모델이 별로였다”로 뭉뚱그리지 않고, 비평이 약했는지, 재작성 요청이 흐렸는지, 검증 조건이 과했는지 나누어 볼 수 있었기 때문이다.\n\n파일 핸드오프 방식도 생각보다 유용했다. `{brief_hash}_input.json`에서 시작해 iteration별 draft, critique, eval, validation 결과로 이어지는 흐름은 글쓰기 과정을 작은 실행 기록으로 바꾼다. 글을 쓸 때는 보통 이전 문장을 지우고 다음 문장으로 넘어가면서 많은 판단이 사라진다. 그런데 이 하네스에서는 이전 초안과 비평, 다음 요청이 분리되어 남는다. 그래서 산출물을 하나씩 열어볼 때, 글의 변화가 대화의 분위기나 기억에 묻히지 않고 파일 단위로 고정된다는 점이 편했다. 특히 여러 run이 쌓일수록 파일명에 brief_hash와 iteration이 들어가는 규칙은 단순한 정리가 아니라 재현성을 위한 장치로 보였다.\n\n검증 게이트가 창작과 분리된 점도 하네스의 장점이다. Validator가 문학적 품질을 판단하지 않고 기계적으로 확인 가능한 항목만 본다는 점은 중요하다. 글이 어색한 문제와 JSON이 깨진 문제, 길이 조건을 놓친 문제는 서로 다른 종류의 실패다. 이걸 한데 묶으면 다음 행동이 흐려진다. README가 REJECT와 ERROR를 나누고, 실패한 검증 결과만 남기도록 한 이유도 여기에 있다. 나는 이 부분에서 개발 도구를 다루는 감각과 글쓰기 도구를 다루는 감각이 만난다고 느꼈다. 실패를 감추지 않고, 다음 실험을 위한 입력으로 남기는 방식이기 때문이다.\n\n물론 단점도 분명했다. 첫 번째 불편은 구조의 무게다. 초안 하나를 얻기 위해 input schema, draft schema, critique schema, eval schema, final schema, rubric, validation result까지 의식해야 한다. 개발자로서는 납득되는 계약이지만, 글을 쓰는 사람의 리듬에서는 호흡이 끊길 수 있다. 실제로 산출물을 따라가다 보면 “지금 글을 쓰고 있나, 파이프라인을 관리하고 있나”라는 감각이 생긴다. 하네스가 안정적일수록 실행 형식이 중요해지는데, 초기 사용자에게는 그 형식이 글 자체보다 먼저 보일 가능성이 있다.\n\n두 번째 불편은 정보 차단이 항상 자연스럽지는 않다는 점이다. Eval이 Critique를 보지 않는 것은 독립성을 지키기 위한 설계이고, Refiner에게 평가 총점 원문을 넘기지 않는 것도 점수 맞추기식 재작성을 줄이려는 선택으로 이해된다. 다만 실제 퇴고에서는 편집자의 비평과 평가자의 판단이 서로 영향을 주며 더 선명해지는 경우도 있다. 하네스는 그 상호작용을 의도적으로 제한한다. 이 제한 덕분에 실험은 깨끗해지지만, 사람의 편집 경험과는 조금 멀어질 때가 있다. 그래서 앞으로는 반드시 차단해야 할 정보와, 실험 조건에 따라 열어볼 수 있는 정보를 구분할 필요가 있다.\n\n세 번째는 반복 정책에서 오는 차가움이다. 최대 iteration을 두는 것은 합리적이다. 계속 돌린다고 글이 계속 좋아지는 것은 아니고, 오히려 루브릭이나 비평 문체에 맞춰 납작해질 수도 있다. 하지만 max_iterations까지 통과하지 못하면 final 대신 failed를 남기는 방식은 사용자 경험 측면에서 건조하게 느껴질 수 있다. 실패 파일 자체는 필요하다. 다만 사용자가 다시 움직일 수 있으려면 “무엇이 실패했는가”보다 “다음에 무엇을 바꾸면 되는가”가 더 빨리 보여야 한다. 이 지점에서 failed.json의 next_actions 품질이 전체 경험을 좌우할 것이다.\n\n보완해야 할 사항의 우선순위는 실패 후 사람이 다시 실험할 수 있게 만드는 피드백을 선명하게 하는 데 있다. 첫째, validation category와 rule만으로 끝내지 말고 사람이 바로 실행할 수 있는 진단 문장을 강화해야 한다. 예를 들어 길이 문제인지, 금칙어 문제인지, 구체적 장면이 부족한 문제인지가 다음 행동으로 번역되어야 한다. 둘째, 글 유형별 루브릭 프로파일이 필요하다. 회고와 개인 에세이를 같은 축으로 시작할 수는 있지만, 어떤 글은 구조보다 톤이 중요하고, 어떤 글은 근거보다 고유한 판단이 더 중요할 수 있다. 셋째, run 디렉토리가 쌓였을 때 실패 원인을 모아보는 흐름이 있으면 좋겠다. 특정 stage가 자주 역할 경계를 넘는지, 길이 조건에서 자주 막히는지, schema 오류가 반복되는지 확인할 수 있어야 하네스 자체를 개선할 수 있다.\n\n다음 실험은 하네스의 성능을 과장하지 않는 방식으로 설계하고 싶다. 같은 brief 하나를 두고, 한쪽은 단일 모델에게 초안 작성과 자기 비평과 재작성을 한 번에 맡긴다. 다른 한쪽은 README의 방식대로 Gen, Critique, Eval, Refine, Validator를 분리해 한 번 실행한다. 비교할 것은 최종 결과의 인상만이 아니다. 이전 초안과 다음 초안 사이의 수정 이유가 추적 가능한지, 실패가 재현 가능한지, 사람이 마지막 퇴고를 할 때 draft, critique, refine request 중 무엇이 실제로 도움이 되는지를 봐야 한다. 이렇게 보면 하네스는 “더 좋은 글을 자동으로 만든다”는 주장보다 “글을 고치는 과정을 더 잘 관찰하게 한다”는 주장에 가까워진다.\n\n결국 이 하네스를 써보며 남은 감각은 편리함보다 통제감이다. 빠르게 그럴듯한 문장을 얻는 도구는 이미 많다. 하지만 개발자 회고나 개인 에세이처럼 생각의 변화와 판단의 흔적이 중요한 글에서는, 빠른 생성만으로는 부족하다. 어떤 입력에서 어떤 초안이 나왔고, 어떤 비평을 거쳐 무엇이 바뀌었는지 남아야 다음 실험이 가능하다. 글쓰기 하네스의 가치는 바로 그 불편한 기록성에 있다. 앞으로의 개선도 더 많은 자동화보다, 사람이 읽고 판단하고 다시 시도할 수 있는 피드백을 더 선명하게 만드는 방향이어야 한다.",
  "accepted_at": "2026-06-16T22:28:50+09:00",
  "quality_snapshot": {
    "rubric_name": "writing:v1",
    "weighted_total": 4.16,
    "scores": {
      "structure": 4.3,
      "evidence": 4,
      "sentence": 4.2,
      "originality": 3.8,
      "purpose_fit": 4.5
    },
    "weak_axes": []
  },
  "contract_result": {
    "verdict": "PASS",
    "contract_errors": [],
    "checked_rules": [
      "schema",
      "brief_hash",
      "min_total",
      "min_axis"
    ]
  },
  "lineage": {
    "run_id": "2026-06-16_9fa3f192",
    "input": "9fa3f192_input.json",
    "draft": "iter_002/9fa3f192_iter-002_draft.json",
    "critique": "iter_002/9fa3f192_iter-002_critique.json",
    "eval": "iter_002/9fa3f192_iter-002_eval.json",
    "refine_request": "memory:001->002"
  }
}
