{
  "brief_hash": "2db504b3",
  "final_iteration": "002",
  "content": "{\"content\":\"회사에서 Go로 결제를 붙일 때 나는 판정 장치가 없는 코드가 어디까지 흐트러지는지 먼저 겪었다. 처음에는 빠르게 붙이는 것이 중요했고, 코드는 절차지향에 가까웠다. 그런데 파일이 1000줄, 2000줄로 커지자 로직은 여기저기로 드리프트했고 god object가 생겼다. 하나를 바꾸려면 어디까지 건드려야 할지 알기 어려웠고, 테스트도 제대로 붙이지 못했다. 그때 부족했던 것은 패턴 이름이 아니었다. 이 코드가 통과 가능한 상태인지 판단할 근거가 내 인상밖에 없었다. 문제는 내 인상이 이미 2000줄 앞에서 신뢰를 잃었다는 점이었다. 판정 장치가 없으면 비용은 나중에 온다. 변경 범위가 흐려지고, 기준은 사람마다 달라지고, 결국 확인해야 할 몫이 다음 사람에게 넘어간다.\\n\\nAI에게 구현을 맡기기 시작하자 같은 문제가 더 커졌다. AI가 만든 결과물은 처음부터 그럴듯한 형태로 온다. 문장은 매끄럽고 구조도 있어 보인다. 그런데 잘 짰는지 다시 물으면 같은 코드에 다른 답이 나오기도 했다. 이때 내가 면접관에게 보여주고 싶은 태도는 AI를 많이 쓴다는 사실이 아니다. 결과물보다 통과 기준과 그 기준이 깨지는 조건을 남기는 사람인가가 더 중요하다고 본다. 팀에서 필요한 사람은 결과가 좋아 보인다고 바로 합격시키는 사람이 아니라, 무엇을 근거로 통과시켰고 어디서 멈춰야 하는지 설명할 수 있는 사람에 가깝다.\\n\\n그래서 구현은 AI에게 통째로 맡기더라도 통과 기준은 내가 쓴 계약으로 남기려 했다. generate-test에서는 Gherkin Feature를 기준으로 삼았다. AI에게 같은 코드를 보고 잘 짰냐고 묻는 판정은 흔들렸지만, Feature가 요구한 행위가 충족되는지는 더 결정적으로 확인할 수 있었다. blog-draft에서도 비슷하게 초안을 만드는 역할과 평가하는 역할을 분리했다. 생성자는 흔들릴 수 있지만, 판정자는 가능한 한 같은 잣대를 유지해야 했다. 루브릭은 글의 구조, 근거, 문장, 고유한 관점, 목적 적합성 같은 축으로 밖에 고정했고, 각 단계가 서로 보지 말아야 할 파일도 나눴다. 핵심은 복잡한 파이프라인을 만든 것이 아니라, 결과물을 만든 쪽과 통과시키는 쪽을 의도적으로 갈라 놓은 것이다.\\n\\n그런데 장치를 만들고 나니 더 중요한 문제가 보였다. 나는 그 장치를 어디까지 믿을 수 있는가. generate-test v1 slow-loop에서 이 문제가 선명해졌다. 원래 실행 결과나 결함 주입 신호가 있으면 AI가 만든 테스트가 실제로 무엇을 잡는지 볼 수 있다. 하지만 SUT가 없는 상황에서는 생성 테스트를 돌릴 수 없었고, 실행 신호를 뺐다. 남은 자동 신호는 LLM이 매긴 루브릭 점수와 critique 반복뿐이었다. 이 순간 판정 장치 자체가 다시 피평가자가 되었다. 점수만 보고 고치면 채점자가 곧 최적화 목표가 된다. 루브릭을 바꾸면 이전과 이후를 같은 잣대로 비교할 수도 없다. 잣대가 움직였는데 좋아졌다고 말하는 것은 확인이 아니라 착각에 가깝다.\\n\\n그래서 몇 가지 선택지를 명시적으로 버렸다. 첫째, 점수가 낮으면 루브릭을 고치는 방식은 기각했다. 점수가 낮다는 사실은 현재 결과물이 기준을 통과하지 못했다는 신호이지, 기준이 틀렸다는 증거가 아니다. 루브릭을 고칠 근거가 되려면 루브릭이 사람의 판정과 어긋난다는 별도의 증거가 있어야 한다. 그래서 낮은 점수는 생성기나 프롬프트를 고칠 후보로 먼저 다루고, 루브릭 변경은 보류하는 쪽으로 제한했다.\\n\\n둘째, 루브릭 변경 제안을 생성기 변경 제안과 똑같이 허용하는 방식도 버렸다. 생성기, 프롬프트, 입력 수집 방식을 바꿀 때는 루브릭이 고정되어 있으므로 전후 비교가 가능하다. 하지만 루브릭 자체를 바꾸면 비교 기준이 사라진다. 그래서 rubric 제안에는 위험이 높고 효과 검증 장치가 없다는 라벨을 붙였고, proposer는 생성기 쪽 대상을 우선하도록 했다. 적용은 자동이 아니라 사람이 한다고 못 박았다. 이 제한은 속도를 늦춘다. 대신 팀에서 기준이 조용히 바뀌는 일을 막는다.\\n\\n셋째, 개인 취향을 평가자에게 주입하는 방식도 버렸다. blog-draft에는 저자의 목소리와 과거 피드백을 담은 soul.md와 memory.md가 있다. 이것은 생성과 퇴고에는 도움이 된다. 하지만 평가까지 저자 취향에 맞추면 판정자는 루브릭이 아니라 취향에 묶인다. 그러면 좋은 글을 고르는 것이 아니라 내 취향에 맞춘 글을 통과시키게 될 가능성이 있다. 취향이 정말 품질 기준이어야 한다면 사람 승인을 거쳐 루브릭으로 승격해야 한다고 정했다. 생성자는 개인화하되, 판정자는 함부로 개인화하지 않는 쪽을 택한 것이다.\\n\\n이 판단은 실제 run 기록 앞에서 더 필요했다. 2026년 6월 29일 blog-draft run 두 개는 모두 최대 iteration까지 갔지만 통과하지 못했다. 한 run은 3.43에서 시작해 마지막에도 3.725에 머물렀고, 기준은 4.1이었다. 이런 숫자를 보면 유혹이 생긴다. 기준을 낮추거나 낮게 나온 축의 설명을 조금 바꾸면 통과율은 좋아 보일 수 있다. 하지만 그 순간 나는 글이 나아졌는지, 판정 장치가 관대해졌는지 구분하지 못한다. 그래서 실제 변경 이력은 기준을 움직이는 대신 생성 쪽을 고치는 방식으로 남겼다. 예를 들어 CHANGELOG에는 raw_text의 핵심 기술 결정, 선택 이유, 설계 판단을 본문에서 생략하지 말라는 프롬프트 변경이 기록되어 있다. 왜 바꿨는지, 어떤 run에서 문제가 반복됐는지, 어느 축을 겨냥했는지도 함께 남겼다.\\n\\n그래도 이 장치는 완성된 답이 아니다. 깨지는 조건이 있다. 사람 verdict가 붙은 동결 캘리브레이션 셋이 없으면, LLM이 만든 것을 LLM 루브릭으로 채점하는 구조는 자기 참조에 갇힌다. 그래서 v2 해결 조건으로 사람 판정이 붙은 과거 아티팩트 일부를 얼려 두고, 루브릭을 바꿀 때 그 셋을 다시 채점해 어느 쪽이 사람 판정과 더 잘 맞는지 보겠다고 적었다. ground truth가 움직이지 않아야 전후 비교가 성립한다.\\n\\n또 하나의 조건은 속도다. 루브릭을 신뢰성 있게 바꿀 수 있는 속도는 사람 verdict가 쌓이는 속도에 묶인다. 이 제약을 인정하지 않으면 시스템은 빠르게 개선되는 것처럼 보이지만 실제로는 자기 점수만 올릴 수 있다. 나는 이 지점을 PROBLEM.md에 열린 문제로 남겼고, rubric 제안을 허용하기 전에 verdict를 최소 몇 건 요구할지도 아직 결정하지 않았다고 적었다. 모르는 것을 닫힌 척하지 않기 위해서다.\\n\\n면접관이 두 시간 안에 확인해야 하는 것은 결과물의 매끄러움만이 아니라고 생각한다. AI가 만든 코드나 글은 점점 더 그럴듯해진다. 그래서 더 필요한 것은 무엇으로 통과시켰는지, 어떤 기준은 왜 버렸는지, 그 기준이 언제 깨지는지를 남기는 습관이다. 확인은 읽는 사람이 캐낼 일이 아니라 쓴 사람이 남겨야 할 일이다. 나는 그 흔적을 말로만 주장하지 않고 PROBLEM.md, 루브릭, CHANGELOG, run artifact로 남기려 했다. 내가 만든 판정 장치를 믿기 위해서가 아니라, 그 장치를 못 믿어야 하는 순간까지 팀이 볼 수 있게 하기 위해서다.\"}",
  "accepted_at": "2026-08-20T10:02:43+09:00",
  "quality_snapshot": {
    "rubric_name": "writing:v1",
    "weighted_total": 4.165,
    "scores": {
      "structure": 4.2,
      "evidence": 4.3,
      "sentence": 3.9,
      "originality": 4.1,
      "purpose_fit": 4.3
    },
    "weak_axes": []
  },
  "contract_result": {
    "verdict": "PASS",
    "contract_errors": [],
    "checked_rules": [
      "schema",
      "brief_hash",
      "min_total",
      "min_axis"
    ]
  },
  "lineage": {
    "run_id": "2026-08-20_2db504b3",
    "input": "2db504b3_input.json",
    "draft": "iter_002/2db504b3_iter-002_draft.json",
    "critique": "iter_002/2db504b3_iter-002_critique.json",
    "eval": "iter_002/2db504b3_iter-002_eval.json",
    "refine_request": "memory:001->002"
  }
}
